{
  "contract_version": "1.0",
  "case_id": "case-fixture-01",
  "frame_accuracy": 0.913,
  "segment_f1": 0.96,
  "per_step": [
    {
      "step_id": "rarp.p03.s01",
      "precision": 1.0,
      "recall": 0.926
    },
    {
      "step_id": "rarp.p04.s01",
      "precision": 0.84,
      "recall": 1.0
    },
    {
      "step_id": "rarp.p04.s02",
      "precision": 1.0,
      "recall": 0.882
    },
    {
      "step_id": "rarp.p05.s01",
      "precision": 0.933,
      "recall": 0.933
    },
    {
      "step_id": "rarp.p06.s01",
      "precision": 0.867,
      "recall": 1.0
    },
    {
      "step_id": "rarp.p07.s02",
      "precision": 1.0,
      "recall": 0.882
    },
    {
      "step_id": "rarp.p08.s01",
      "precision": 0.92,
      "recall": 1.0
    },
    {
      "step_id": "rarp.p09.s01",
      "precision": 0.0,
      "recall": 0.0
    },
    {
      "step_id": "rarp.p09.s02",
      "precision": 0.667,
      "recall": 0.952
    },
    {
      "step_id": "rarp.p10.s01",
      "precision": 0.9,
      "recall": 1.0
    },
    {
      "step_id": "rarp.p10.s02",
      "precision": 1.0,
      "recall": 0.833
    },
    {
      "step_id": "rarp.p12.s01",
      "precision": 0.967,
      "recall": 0.967
    },
    {
      "step_id": "rarp.p12.s02",
      "precision": 0.933,
      "recall": 1.0
    }
  ],
  "n_frames": 300,
  "model_info": {
    "model_tier": "VISION_FAST",
    "model": "fixture",
    "prompt_version": "step_window.v1"
  }
}
